{
  "command_id": "a0000000-0000-4000-8000-000000000001",
  "session_id": "sess-worker-playwright-01",
  "command_type": "ENSURE_SESSION",
  "status": "SUCCESS",
  "timestamp_utc": "2026-08-16T12:00:05Z",
  "duration_ms": 4500,
  "result": {
    "session_active": true,
    "account_alias": "creator-account-1",
    "authenticated": true
  }
}
